<!-- edited with XML Spy v3.5 NT (http://www.xmlspy.com) by  () -->
<Task_Table xmlns:a="http://www.acsys.it/schemas/IPF" xmlns:xsi="http://www.w3.org/2000/10/XMLSchema-instance" xsi:schemaLocation="http://www.acsys.it/schemas/IPF TaskTable.xsd">
	<Processor_Name>SIR2LRC1</Processor_Name>
	<Version>1.0</Version>
	<Test>No</Test>
	<Min_Disk_Space units="MB">1024</Min_Disk_Space>
	<Max_Time units="sec">0</Max_Time>
	<Private_Config>
		<List_of_Cfg_Files count="1">
			<Cfg_File>
				<Version>1.0</Version>
				<File_Name>/usr/acs/processors/ipf1Va2.0/processors/config_files/CS_TEST_PCONF_PAR20040101_000000_20041231_000000_0001.XML</File_Name>
			</Cfg_File>
		</List_of_Cfg_Files>
		<Default>0</Default>
	</Private_Config>
	<List_of_Config_Spaces count="1">
		<Config_Space>Geophysical_Constants</Config_Space>
	</List_of_Config_Spaces>
	<List_of_Pools count="2">
		<Pool>
			<Detached>false</Detached>
			<Killing_Signal>15</Killing_Signal>
			<List_of_Tasks count="1">
				<Task>
					<Name>IPF1_SIR2_CAL1_STUB</Name>
					<Version>1.0</Version>
					<Critical>true</Critical>
					<Criticality_Level>1</Criticality_Level>
					<File_Name>/usr/acs/bin/ipf1_cal_stub</File_Name>
					<List_of_Inputs count="5">
						<Input>
							<Mode>ALWAYS</Mode>
							<Mandatory>Yes</Mandatory>
							<List_of_Alternatives count="1">
								<Alternative>
									<Order>0</Order>
									<Origin>DB</Origin>
									<Retrieval_Mode>ValCover</Retrieval_Mode>
									<T0>0</T0>
									<T1>0</T1>
									<File_Type>SIR2LRC10_</File_Type>
									<File_Name_Type>Physical</File_Name_Type>
								</Alternative>
							</List_of_Alternatives>
						</Input>
						<Input>
							<Mode>NRT</Mode>
							<Mandatory>Yes</Mandatory>
							<List_of_Alternatives count="2">
								<Alternative>
									<Order>0</Order>
									<Origin>DB</Origin>
									<Retrieval_Mode>LatestValCover</Retrieval_Mode>
									<T0>0</T0>
									<T1>0</T1>
									<File_Type>DOR_NAV_0_</File_Type>
									<File_Name_Type>Physical</File_Name_Type>
								</Alternative>
								<Alternative>
									<Order>1</Order>
									<Origin>DB</Origin>
									<Retrieval_Mode>LatestValCover</Retrieval_Mode>
									<T0>0</T0>
									<T1>0</T1>
									<File_Type>MPL_ORBPRE</File_Type>
									<File_Name_Type>Physical</File_Name_Type>
								</Alternative>
							</List_of_Alternatives>
						</Input>
						<Input>
							<Mode>SISTEMATIC</Mode>
							<Mandatory>Yes</Mandatory>
							<List_of_Alternatives count="1">
								<Alternative>
									<Order>0</Order>
									<Origin>DB</Origin>
									<Retrieval_Mode>LatestValCover</Retrieval_Mode>
									<T0>0</T0>
									<T1>0</T1>
									<File_Type>AUX_ORBDOR</File_Type>
									<File_Name_Type>Physical</File_Name_Type>
								</Alternative>
							</List_of_Alternatives>
						</Input>
						<Input>
							<Mode>REPROCESSING</Mode>
							<Mandatory>Yes</Mandatory>
							<List_of_Alternatives count="1">
								<Alternative>
									<Order>0</Order>
									<Origin>DB</Origin>
									<Retrieval_Mode>LatestValCover</Retrieval_Mode>
									<T0>0</T0>
									<T1>0</T1>
									<File_Type>AUX_ORBDOR</File_Type>
									<File_Name_Type>Physical</File_Name_Type>
								</Alternative>
							</List_of_Alternatives>
						</Input>
						<Input>
							<Mode>ALWAYS</Mode>
							<Mandatory>Yes</Mandatory>
							<List_of_Alternatives count="1">
								<Alternative>
									<Order>0</Order>
									<Origin>DB</Origin>
									<Retrieval_Mode>LatestValIntersect</Retrieval_Mode>
									<T0>0</T0>
									<T1>0</T1>
									<File_Type>IPF_DBASE_</File_Type>
									<File_Name_Type>Physical</File_Name_Type>
								</Alternative>
							</List_of_Alternatives>
						</Input>
						<Input>
							<Mode>ALWAYS</Mode>
							<Mandatory>Yes</Mandatory>
							<List_of_Alternatives count="1">
								<Alternative>
									<Order>0</Order>
									<Origin>DB</Origin>
									<Retrieval_Mode>LatestValCover</Retrieval_Mode>
									<T0>0</T0>
									<T1>0</T1>
									<File_Type>MPL_ORBPRE</File_Type>
									<File_Name_Type>Physical</File_Name_Type>
								</Alternative>
							</List_of_Alternatives>
						</Input>
					</List_of_Inputs>
					<List_of_Outputs count="0"/>
					<List_of_Breakpoints count="0"/>
				</Task>
			</List_of_Tasks>
		</Pool>
		<Pool>
			<Detached>false</Detached>
			<Killing_Signal>15</Killing_Signal>
			<List_of_Tasks count="1">
				<Task>
					<Name>INVENTORY</Name>
					<Version>1.0</Version>
					<Critical>true</Critical>
					<Criticality_Level>1</Criticality_Level>
					<File_Name>/usr/acs/bin/Inventory</File_Name>
					<List_of_Inputs count="0"/>
					<List_of_Outputs count="0"/>
					<List_of_Breakpoints count="0"/>
				</Task>
			</List_of_Tasks>
		</Pool>
	</List_of_Pools>
</Task_Table>
